Name,Description,Feature 1,Feature 2,Feature 3,Key Ingredients
Crimson Cherry Cooler,"Sip on the vibrant taste of Crimson Cherry Cooler, a refreshing blend of tart cherries and sparkling water. Perfect for a sunny day refreshment.",Tart cherry flavor,Sparkling water,Refreshing and vibrant,Cherries, carbonated water, sugar
Azure Apple Fizz,"Dive into the crisp and bubbly Azure Apple Fizz. This sparkling apple cider offers a sweet, refreshing taste with every effervescent sip.",Crisp apple flavor,Effervescent bubbles,Sweet and refreshing,Apple juice, carbonated water, sugar
Mango Melody Mix,"Tropical flavors await in Mango Melody Mix, a smooth blend of ripe mangoes and a hint of coconut. It's like a beach vacation in a bottle.",Ripe mango flavor,Hint of coconut,Smooth tropical blend,Mango puree, coconut water, sugar
Lemon Lime Leap,"Experience the zesty burst of Lemon Lime Leap, a citrus-packed beverage that energizes and refreshes with its tangy flavor.",Zesty citrus flavor,Energizing and refreshing,Tangy taste,Lemon juice, lime juice, sugar, water
Berry Bliss Brew,"Indulge in the sweet symphony of Berry Bliss Brew, a mixed berry tea that combines blueberries, raspberries, and strawberries in a delightful drink.",Mixed berry blend,Sweet and indulgent,Delightful and refreshing,Blueberry, raspberry, strawberry, water
Ginger Gold Rush,"Spice up your day with Ginger Gold Rush, a bold ginger beer that packs a punch with its strong, spicy flavor and a hint of sweetness.",Strong ginger flavor,Spicy with a sweet hint,Bold and invigorating,Ginger, sugar, carbonated water
Peach Sparkle Soda,"Fizz up your life with Peach Sparkle Soda, where juicy peaches meet bubbly soda in this sweet, sparkling treat.",Juicy peach flavor,Bubbly soda,Sweet and sparkling,Peach juice, carbonated water, sugar
Cool Cucumber Quencher,"Refresh and hydrate with Cool Cucumber Quencher, a light and soothing drink infused with cucumber and a splash of mint.",Cucumber infusion,Light and soothing,Splash of mint,Cucumber, mint, water, sugar
Vanilla Velvet Cream,"Savor the rich, creamy taste of Vanilla Velvet Cream, a luxurious vanilla bean milkshake that's smooth and decadently delicious.",Rich vanilla bean flavor,Creamy and luxurious,Smooth and delicious,Vanilla beans, milk, sugar
Tropical Tangerine Twist,"Twist up your routine with Tropical Tangerine Twist, a vibrant blend of tangerine and tropical fruits that offers a refreshing escape.",Vibrant tangerine flavor,Blend of tropical fruits,Refreshing and vibrant,Tangerine, tropical fruits, water, sugar
Pineapple Paradise Punch,"Escape to paradise with Pineapple Paradise Punch, a sweet and tangy pineapple drink that's perfect for sipping under the sun.",Sweet pineapple flavor,Tangy and refreshing,Perfect for sunny days,Pineapple juice, water, sugar
Raspberry Ripple Refresher,"Enjoy the playful swirl of Raspberry Ripple Refresher, a raspberry lemonade that combines sweet raspberries with a tart lemon twist.",Sweet raspberries,Tart lemon twist,Playful and refreshing,Raspberry, lemon juice, sugar, water
Mint Mojito Mocktail,"Cool down with a Mint Mojito Mocktail, a non-alcoholic version of the classic that's just as refreshing with mint, lime, and sparkling water.",Minty freshness,Non-alcoholic,Just as refreshing,Mint, lime, sugar, carbonated water
Spiced Apple Cider,"Warm up with Spiced Apple Cider, a cozy beverage infused with cinnamon and nutmeg, perfect for chilly evenings.",Warm spiced flavor,Cozy and comforting,Perfect for chilly evenings,Apple cider, cinnamon, nutmeg
Blackberry Bramble Blast,"Blast off with Blackberry Bramble Blast, a blackberry infused energy drink that boosts your energy with natural flavors and caffeine.",Blackberry infusion,Energy boosting,Natural flavors and caffeine,Blackberry juice, caffeine, sugar, water
Kiwi Kale Smoothie,"Blend up a healthy treat with Kiwi Kale Smoothie, a nutrient-packed drink combining kiwi, kale, and a hint of honey for sweetness.",Nutrient-packed,Healthy and delicious,Hint of honey,Kiwi, kale, honey, water
Iced Coconut Coffee,"Chill out with Iced Coconut Coffee, a cool blend of robust coffee and creamy coconut, perfect for coffee lovers looking for a tropical twist.",Robust coffee flavor,Creamy coconut blend,Cool and refreshing,Coffee, coconut milk, ice
Strawberry Sunset Slush,"Watch the sunset with a Strawberry Sunset Slush, a frozen strawberry treat that cools and delights with its icy texture and sweet flavor.",Frozen strawberry treat,Icy texture,Sweet and cooling,Strawberry, ice, sugar
Blueberry Basil Booster,"Boost your day with Blueberry Basil Booster, a unique blend of blueberries and basil that revitalizes and refreshes.",Unique blueberry and basil blend,Revitalizing and refreshing,Flavorful and unique,Blueberries, basil, water, sugar
Pomegranate Power Potion,"Power up with Pomegranate Power Potion, a pomegranate-based energy drink that invigorates with antioxidants and a zesty flavor.",Pomegranate base,Antioxidant-rich,Invigorating and zesty,Pomegranate juice, caffeine, sugar
Caramel Latte Luxe,"Luxuriate in Caramel Latte Luxe, a creamy latte with a rich caramel swirl, combining coffee's boldness with the sweetness of caramel.",Creamy latte,Rich caramel swirl,Luxurious and bold,Coffee, milk, caramel
Saffron Sizzle Soda,"Experience the exotic with Saffron Sizzle Soda, a unique soda infused with saffron and a hint of lemon, offering a vibrant and unusual taste.",Saffron infusion,Unique and vibrant,Hint of lemon,Saffron, lemon, sugar, carbonated water
Green Tea Glimmer,"Glimmer through your day with Green Tea Glimmer, a light and refreshing green tea enhanced with jasmine and a touch of honey.",Light green tea,Jasmine enhanced,Touch of honey,Green tea, jasmine, honey
Watermelon Wave Water,"Ride the wave with Watermelon Wave Water, a hydrating watermelon water that quenches thirst with a hint of mint for extra freshness.",Hydrating watermelon water,Quenches thirst,Hint of mint,Watermelon, mint, water
Grapefruit Grove Glimpse,"Get a glimpse of the grove with Grapefruit Grove Glimpse, a grapefruit juice blend that's tart, refreshing, and perfect for grapefruit lovers.",Tart grapefruit flavor,Refreshing juice blend,Perfect for grapefruit lovers,Grapefruit, water, sugar
Almond Amaretto Affair,"Indulge in an Almond Amaretto Affair, a sweet almond-flavored coffee that combines the rich taste of amaretto for a decadent drink.",Sweet almond flavor,Rich amaretto taste,Decadent and indulgent,Coffee, almond flavor, amaretto
Banana Berry Blast,"Go bananas with Banana Berry Blast, a smoothie that combines bananas and mixed berries for a fruity explosion of flavor.",Bananas and mixed berries,Fruity explosion,Smooth and delicious,Bananas, mixed berries, yogurt
Cinnamon Citrus Cyclone,"Get swept away by Cinnamon Citrus Cyclone, a spiced citrus drink that energizes with its bold flavors and a dash of cinnamon.",Spiced citrus flavor,Energizes with bold flavors,Dash of cinnamon,Citrus juice, cinnamon, sugar, water
Pear Peppermint Punch,"Freshen up with Pear Peppermint Punch, a pear-infused drink with a refreshing peppermint twist, perfect for a hot day.",Pear-infused,Refreshing peppermint twist,Perfect for hot days,Pear juice, peppermint, water
Hibiscus Harmony Tea,"Find your harmony with Hibiscus Harmony Tea, a soothing herbal tea made from hibiscus flowers, offering a tart flavor and a floral aroma.",Soothing herbal tea,Tart flavor,Floral aroma,Hibiscus flowers, water, sugar